sentence,yngve_score,frazier_score,dependency_distance_score,count,year
"The parser uses around 180 megabytes of memory, and training on 40,000 sentences (essentially extracting the co-occurrence counts from the corpus) takes under 15 minutes.",3,0.8793103448275862,4,29,1996
Loading the hash table of bigram counts into memory takes approximately 8 minutes.,2,0.9642857142857143,2,14,1996
Two strategies are employed to improve parsing eciency.,1,1.0,1,9,1996
"First, a constant probability threshold is used while building the chart  any constituents with lower probability than this threshold are discarded.",2,0.7608695652173914,3,23,1996
"If a parse is found, it must be the highest ranked parse by the model.",2,1.088235294117647,2,17,1996
"If no parse is found, the threshold is lowered and parsing is attempted again.",4,0.78125,2,16,1996
The process continues until a parse is found.,1,1.0,2,9,1996
"Second, a beam search strategy is used.",2,0.6111111111111112,2,9,1996
"For each span of words in the sentence the probability, Ph, of the highest probability constituent is recorded.",3,0.8333333333333334,3,21,1996
All other constituents spanning the same words must have probability greater than Ph  for some constant beam size   constituents which fall out of this beam are discarded.,3,1.0,3,28,1996
"The method risks introducing search-errors, but in practice eciency can be greatly improved with virtually no loss of accuracy.",3,0,2,21,1996
Table 5 shows the trade-o between speed and accuracy as the beam is narrowed.,2,0.8666666666666667,3,15,1996
Table 5.,1,1,1,3,1996
The trade-o between speed and accuracy as the beam-size is varied.,2,0.875,2,12,1996
Model (3) was used for this test on all sentences  100 words in section 23.,2,0.9166666666666666,2,18,1996
We have shown that a simple statistical model based on dependencies between words can parse Wall Street Journal news text with high accuracy.,2,0.875,3,24,1996
The method is equally applicable to tree or dependency representations of syntactic structures.,2,0.6785714285714286,1,14,1996
"There are many possibilities for improvement, which is encouraging.",1,1.2727272727272727,1,11,1996
More sophisticated estimation techniques such as deleted interpolation should be tried.,2,1.0,1,12,1996
Estimates based on relaxing the distance measure could also be used for smoothing  at present we only back-o on words.,2,1.2857142857142858,2,21,1996
"The distance measure could be extended to capture more context, such as other words or tags in the sentence.",2,0.7619047619047619,2,21,1996
"Finally, the model makes no account of valency.",2,0.85,1,10,1996
"I would like to thank Mitch Marcus, Jason Eisner, Dan Melamed and Adwait Ratnaparkhi for many useful discussions, and for comments on earlier versions of this paper.",3,0.7741935483870968,4,31,1996
I would also like to thank David Magerman for his help with testing SPATTER.,2,1.0,2,15,1996
