sentence,yngve_score,frazier_score,dependency_distance_score,count,year
"From the arguments in the previous section, parametric methods are optimal  provided that two assumptions hold.",3.2777777777777777,0.8333333333333334,2.473684210526316,18,2005
1 The distribution generating the data is in the class of distributions being  considered.,2.3333333333333335,1.1,2.3125,15,2005
"2 The training set is large enough for the distribution dened by the maximum likelihood estimates to converge to the true distribution D(x, y) (in general the guarantees of ML estimation are asymptotic, holding only in the limit as the training data size goes to innity).",3.4814814814814814,0.9259259259259259,3.962962962962963,54,2005
This paper proposes alternatives to maximum-likelihood methods which give theoretical guarantees without making either of these assumptions.,2.111111111111111,1.1388888888888888,2.2,18,2005
"There is no assumption that the distribution generating the data comes from some predened class  the only assumption is that the same, unknown distribution generates both training and test examples.",2.71875,0.8125,4.121212121212121,32,2005
"The methods also provide bounds suggesting how many training samples are required for learning, dealing with the case where there is only a nite amount of training data.",3.2,1.0166666666666666,2.6,30,2005
A crucial idea in distribution-free learning is that of a hypothesis space.,2.4615384615384617,0.7307692307692307,2.1333333333333333,13,2005
"This is a set of functions under consideration, each member of the set being a function h .",2.1052631578947367,1.0,3.1578947368421053,19,2005
X  Y.,0.5,1.5,1.0,2,2005
"For example, in weighted context-free grammars the hypothesis space is.",3.4166666666666665,0.625,2.7142857142857144,12,2005
"So each possible parameter setting denes a different function from sentences to trees, and H is the innite set of all such functions as  ranges over the parameter space n.",2.870967741935484,0.7096774193548387,3.3636363636363638,31,2005
Learning is then usually framed as the task of choosing a good function in H on the basis of a training sample as evidence.,2.88,0.96,2.7777777777777777,25,2005
This strategy is called Empirical Risk Minimization (ERM) by Vapnik (1998).,2.5625,0.84375,2.7222222222222223,16,2005
Two questions which arise are.,2.1666666666666665,1.5,1.3333333333333333,6,2005
"In the limit, as the training size goes to innity, does the error of the ERM method Er(h) approach the error of the best function in the set, Er(h), regardless of the underlying distribution D(x, y)?",3.843137254901961,0.7941176470588235,4.0,51,2005
"In other words, is this method of choosing a hypothesis always consistent?",2.857142857142857,0.9285714285714286,2.4285714285714284,14,2005
The answer to this depends on the nature of the hypothesis space H. For nite hypothesis spaces the ERM method is always consistent.,2.8333333333333335,0.875,1.8333333333333333,24,2005
"For many innite hypothesis spaces, such as the hyperplane classiers described in section 6 of this paper, the method is also consistent.",4.72,0.7,2.48,25,2005
"However, some innite hypothesis spaces can lead to the method being inconsistent  specically, if a measure called the Vapnik-Chervonenkis (VC) dimension (Vapnik and Chervonenkis, 1971) of H is innite, the ERM method may be inconsistent.",5.954545454545454,0.9318181818181818,5.1063829787234045,44,2005
"Intuitively, the VC dimension can be thought of as a measure of the complexity of an innite set of hypotheses.",2.409090909090909,0.7954545454545454,2.5,22,2005
"If the method is consistent, how quickly does Er(h) converge to Er(h)?",2.9,1.15,2.125,20,2005
"In other words, how much training data is needed to have a good chance of getting close to the best function in H?",2.64,1.0,2.44,25,2005
We will see in the next section that the convergence rate depends on various measures of the size of the hypothesis space.,2.347826086956522,0.8260869565217391,3.0,23,2005
"For nite sets, the rate of convergence depends directly upon the size of H. For innite sets, several measures have been proposed  we will concentrate on rates of convergence based on a concept called the margin of a hypothesis on training examples.",2.7333333333333334,1.0666666666666667,2.130434782608696,45,2005
This section gives results and analysis for situations where the hypothesis space H is a nite set.,2.5,0.7777777777777778,2.7777777777777777,18,2005
This is in some ways an unrealistically simple situation  many hypothesis spaces used in practice are innite sets  but we give the results and proofs because they can be useful in developing intuition for the nature of convergence bounds.,3.775,0.8625,3.7142857142857144,40,2005
In the following sections we consider innite hypothesis spaces such as weighted context-free grammars.,2.6666666666666665,0.6333333333333333,2.6470588235294117,15,2005
A couple of basic results from probability theory will be very useful.,2.4615384615384617,0.8846153846153846,1.8461538461538463,13,2005
The rst results are the Chernoff bounds.,2.125,0.5625,1.75,8,2005
"Consider a binary random variable X (such as the result of a coin toss) which has probability p of being 1, and (1  p) of being 0.",3.6666666666666665,1.0151515151515151,4.5,33,2005
"Now consider a sample of size m, {x1, x2, .",2.7857142857142856,0.8214285714285714,2.857142857142857,14,2005
.,0.0,1.0,0.0,1,2005
.,0.0,1.0,0.0,1,2005
", xm} drawn from this process.",2.375,0.75,1.75,8,2005
Dene the relative frequency of xi = 1 (the coin coming  up heads) in this sample to be p = Pi xi/m.,2.8,1.02,3.5357142857142856,25,2005
"The relative frequency p is a  very natural estimate of the underlying probability p, and by the law of large numbers p will converge to p as the sample size m goes to innity.",4.027777777777778,0.6527777777777778,3.5405405405405403,36,2005
"Chernoff bounds give results concerning how quickly p converges to p. Thus Chernoff bounds go a step further than the law of large numbers, which is an asymptotic result (a result concerning what happens as the sample size goes to innity).",3.2,1.011111111111111,2.8,45,2005
The bounds are.,1.5,0.875,0.75,4,2005
Theorem 1 (Chernoff Bounds).,2.0,0.5714285714285714,1.5714285714285714,7,2005
"For all p  [0, 1],  > 0, with the probability P being taken over the distribution of training samples of size m generated with underlying parameter p.  The rst bound states that for all values of p, and for all values of , if we repeatedly draw training samples of size m of a binary variable with underlying probability p, the relative proportion of training samples for which the value (p p) exceeds  is at most3 e2m2.",3.5454545454545454,0.8636363636363636,3.902173913043478,33,2005
"It is always possible for p to diverge substantially from p  it is possible to draw an extremely unrepresentative training sample, such as a sample of all heads when p = 0.7, for example  but as the sample size is increased the chances of us being this unlucky become increasingly unlikely.",4.592592592592593,1.0833333333333333,3.8035714285714284,54,2005
A second useful result is the Union Bound.,2.4444444444444446,0.7222222222222222,1.8888888888888888,9,2005
Here we use the notation P [AB] to mean the probability of A or B occurring.,2.526315789473684,0.9473684210526315,2.9473684210526314,19,2005
The Union Bound follows directly from the axioms of probability theory.,2.1666666666666665,0.9583333333333334,1.8333333333333333,12,2005
"For example, if n = 2, then P [A1  A2] = P [A1] + P [A2]  P [A1A2]  P [A1] + P [A2], where P [A1A2] means the probability of both A1 and A2 occurring.",5.452830188679245,0.5754716981132075,3.5714285714285716,53,2005
The more general result for all n follows by induction on n.  We are now in a position to apply these results to learning problems.,2.6923076923076925,0.8846153846153846,1.8148148148148149,13,2005
"First, consider just a single member of H, a function h. Say we draw a training sample {(x1, y1), .",3.925925925925926,0.7407407407407407,2.740740740740741,27,2005
.,0.0,1.0,0.0,1,2005
.,0.0,1.0,0.0,1,2005
", (xm, ym)} from some unknown distribution D(x, y).",3.2222222222222223,0.8333333333333334,3.5,18,2005
"We can calculate the relative frequency of errors of h on this sample,  So for any single member of H, the Chernoff bound describes how its observed error on the training set is related to its true probability of error.",3.883720930232558,0.8604651162790697,3.6363636363636362,43,2005
"Now consider the entire set of hypotheses H. Say we assign an arbitrary ordering to the n = |H| hypotheses, so that H = {h1, h2, .",3.606060606060606,0.9848484848484849,5.032258064516129,33,2005
.,0.0,1.0,0.0,1,2005
.,0.0,1.0,0.0,1,2005
", hn}.",1.0,0.5,0.5,4,2005
Consider the probability of any one of the hypotheses hi having its estimated loss Er(hi) diverge by more than  from its expected loss Er(hi).,3.129032258064516,0.9838709677419355,4.714285714285714,31,2005
"Thus for all hypotheses h in the set H, Er(h) converges to Er(h) as the sample size m goes to innity.",3.5517241379310347,0.8275862068965517,3.48,29,2005
"This result is known as a Uniform Convergence Result, in that it describes how a whole set of empirical error rates converge to their respective expected errors.",2.8620689655172415,0.7758620689655172,3.586206896551724,29,2005
Note that this result holds for the hypothesis with minimum error on the training sample.,2.375,0.875,2.4375,16,2005
"It can be shown that this implies that the ERM method for nite hypothesis spaces  choosing the hypothesis h which has minimum error on the training sample  is consistent, in that in the limit as m  , the error of h converges to the error of the minimum error hypothesis.",4.865384615384615,0.9134615384615384,3.482142857142857,52,2005
Another important result is how the rate of convergence depends on the size of the hypothesis space.,2.3333333333333335,0.9444444444444444,2.5555555555555554,18,2005
"Qualitatively, the bound implies that to avoid overtraining the number of training samples should scale with log |H|.",2.4545454545454546,1.0,3.95,22,2005
"Ideally, we would like a learning method to have expected error that is close Now consider the ERM  to the loss of the bayes-optimal hypothesis hB.",2.392857142857143,1.0,3.0,28,2005
method.,0.5,0.5,0.5,2,2005
Breaking the error down in this way suggests that there are two components to the difference from the optimal loss Er(hB).,2.64,0.82,3.0434782608695654,25,2005
"The rst term captures the errors due to a nite sample size  if the hypothesis space is too large, then theorem 3 states that there is a good chance that the ERM method will pick a hypothesis that is far from the best in the hypothesis space, and the rst term will be large.",5.175438596491228,0.7631578947368421,3.9827586206896552,57,2005
"Thus the rst term indicates a pressure to keep H small, so that there is a good   chance of nding the best hypothesis in the set.",2.7857142857142856,0.8571428571428571,2.7241379310344827,28,2005
"In contrast, the second term reects a pressure to make H large, so that there is a good chance that at least one of the hypotheses is close to the Bayes optimal hypothesis.",2.9722222222222223,0.8333333333333334,3.3333333333333335,36,2005
"The two terms can be thought of as being analogues to the familiar biasvariance trade-off, the rst term being a variance term, the second being the bias.",4.733333333333333,0.6166666666666667,3.7222222222222223,30,2005
In this section we describe a method which explicitly attempts to model the trade-off between these two types of errors.,2.3333333333333335,1.119047619047619,2.4782608695652173,21,2005
"Rather than picking a single hypothesis class, Structural Risk Minimization (Vapnik, 1998) advocates picking a set of hypothesis classes H1, H2, .",3.75,0.6428571428571429,3.2142857142857144,28,2005
.,0.0,1.0,0.0,1,2005
.,0.0,1.0,0.0,1,2005
", Hs of increasing size (i.e., such that |H1| < |H2| <    < |Hs|).",3.375,0.9166666666666666,3.4285714285714284,24,2005
"The following theorem then applies (it is an extension of theorem 3, and is derived in a similar way through application of the Chernoff and Union bounds).",3.903225806451613,0.6935483870967742,3.6774193548387095,31,2005
"Theorem 4 Assume a set of nite hypothesis classes {H1, H2, .",3.3333333333333335,0.7,2.533333333333333,15,2005
.,0.0,1.0,0.0,1,2005
.,0.0,1.0,0.0,1,2005
", Hs}, and some distribution D(x, y).",3.0,0.7142857142857143,2.6666666666666665,14,2005
"For all i = 1, .",1.8571428571428572,0.8571428571428571,1.4285714285714286,7,2005
.,0.0,1.0,0.0,1,2005
.,0.0,1.0,0.0,1,2005
", s, for all hypotheses h  Hi, with probability at least 1   over the choice of training set of size m drawn from D.  This theorem is very similar to theorem 3, except that the second term in the bound now varies depending on which Hi a function h is drawn from.",3.4444444444444446,0.7777777777777778,3.433333333333333,27,2005
Note also that we pay an extra price of log(s) for our hedging over which of the hypothesis spaces the function is drawn from.,2.7857142857142856,1.0178571428571428,3.423076923076923,28,2005
The SRM principle is then as follows.,2.125,1.0,1.625,8,2005
"1 Pick a set of hypothesis classes, Hi for i = 1, .",2.533333333333333,1.0333333333333334,3.533333333333333,15,2005
.,0.0,1.0,0.0,1,2005
.,0.0,1.0,0.0,1,2005
", s, of increasing size.",2.0,1.1428571428571428,1.7142857142857142,7,2005
This must be done independently of the training data for the above bound to apply.,2.3125,1.0,2.625,16,2005
2 Choose the hypothesis h which minimizes the bound in theorem 4.,2.076923076923077,1.1538461538461537,2.230769230769231,13,2005
"Thus rather than simply choosing the hypothesis with the lowest error on the training sample, there is now a trade-off between training error and the size of the hypothesis space of which h is a member.",3.8421052631578947,0.8289473684210527,3.0,38,2005
The SRM method advocates picking a compromise between keeping the number of training errors small versus keeping the size of the hypothesis class small.,3.0,1.0,2.2,25,2005
Note that this approach has a somewhat similar avour to Bayesian approaches.,2.230769230769231,0.9230769230769231,2.6153846153846154,13,2005
The Maximum A-Posteriori (MAP) estimates in a Bayesian approach involve choosing the parameters which maximize a combination of the data likelihood and a prior over the parameter values.,2.6774193548387095,0.9354838709677419,2.8484848484848486,31,2005
The rst term is a measure of how well the parameters  t the data.,2.466666666666667,0.8666666666666667,2.375,15,2005
The second term is a prior which can be interpreted as a term which penalizes more complex parameter settings.,2.25,1.075,2.4,20,2005
The SRM approach in our example implies choosing the hypothesis that minimizes the bound in theorem 4.,2.388888888888889,1.1388888888888888,2.0555555555555554,18,2005
"The function indicating the goodness of a hypothesis h again has two terms, one measuring how well the hypothesis ts the data, the second penalizing hypotheses which are too complex.",2.9393939393939394,0.9242424242424242,3.5405405405405403,33,2005
Here complexity has a very specic meaning.,2.0,0.8125,2.125,8,2005
it is a direct measure of how quickly the training data error Er(h) converges to its true value Er(h).,3.0,0.7692307692307693,3.727272727272727,26,2005
"This section describes analysis applied for binary classiers, where the set Y = {1, +1}.",3.0,0.95,3.263157894736842,20,2005
"We consider hyperplane classiers, where a linear separator in some feature space is used to separate examples into the two classes.",2.5217391304347827,0.9347826086956522,3.260869565217391,23,2005
This section describes uniform convergence bounds for hyperplane classiers.,2.1,0.75,1.9,10,2005
Algorithms which explicitly minimize these bounds  namely the Support Vector Machine and Boosting algorithms  are described in section 8.,3.6,0.8,3.6363636363636362,20,2005
There has been a large amount of research devoted to the analysis of hyperplane classiers.,2.0625,0.96875,2.1875,16,2005
"They go back to one of the earliest learning algorithms, the Perceptron algorithm (Rosenblatt, 1958).",2.75,0.825,3.05,20,2005
They are similar to the linear models for parsing we proposed in section 2 (in fact the framework of section 2 can be viewed as a generalization of hyperplane classiers).,2.787878787878788,1.0606060606060606,2.9696969696969697,33,2005
"We will initially review some results applying to linear classiers, and then discuss how various results may be applied to linear models for parsing.",3.1923076923076925,1.0,3.1538461538461537,26,2005
"We will discuss a hypothesis space of n-dimensional hyperplane classiers,  dened as follows.",2.4,0.9333333333333333,3.4444444444444446,15,2005
Each instance x is represented as a vector (x) in n.,1.6153846153846154,0.9615384615384616,2.6153846153846154,13,2005
There is a clear geometric interpretation of this classier.,2.2,0.85,2.3,10,2005
The points (x) are in n-dimensional Euclidean space.,2.3636363636363638,0.7727272727272727,2.1666666666666665,11,2005
"The parameters , b dene a hyperplane through the   space, the hyperplane being the set of points z such that (z   + b) = 0.",2.9655172413793105,0.9655172413793104,3.272727272727273,29,2005
"This is a hyperplane with normal , at distance b/|||| from the origin, j .",3.2857142857142856,0.9761904761904762,4.117647058823529,21,2005
This hyperplane is used to classify points.,1.75,1.125,1.5,8,2005
"all points falling on one side of the hyperplane are classied as +1, points on the other side are classied as 1.",4.125,0.8333333333333334,2.24,24,2005
"It can be shown that the ERM method is consistent for hyperplanes, through a method called VC analysis (Vapnik and Chervonenkis, 1971).",2.5555555555555554,0.9629629629629629,3.0,27,2005
"We will not go into details here, but roughly speaking, the VC-dimension of a hypothesis space is a measure of its size or complexity.",3.4074074074074074,0.6296296296296297,3.103448275862069,27,2005
A set of hyperplanes in n has VC dimension of (n + 1).,2.5625,0.96875,2.0625,16,2005
For any hypothesis space with nite VC dimension the ERM method is consistent.,3.357142857142857,0.6785714285714286,2.2142857142857144,14,2005
An alternative to VC-analysis is to analyse hyperplanes through properties of margins on training examples.,2.125,1.1875,2.75,16,2005
"For any hyperplane dened by parameters (, b), for a training sample {(x1, y1), .",3.739130434782609,0.782608695652174,3.4166666666666665,23,2005
.,0.0,1.0,0.0,1,2005
.,0.0,1.0,0.0,1,2005
", (xm, ym)}, the margin on the i-th training example is dened as  The margin ,b has a simple geometric interpretation.",5.571428571428571,0.6428571428571429,3.8666666666666667,28,2005
"it is the minimum distance of any training point to the hyperplane dened by , b.",1.5625,0.90625,2.823529411764706,16,2005
The following theorem then holds.,2.5,0.75,1.1666666666666667,6,2005
Theorem 5 (Shawe-Taylor et al.,1.7142857142857142,1.0,2.0,7,2005
1998).,1.0,0.3333333333333333,1.0,3,2005
"Assume the hypothesis class H is a set of hyperplanes, and that there is some distribution D(x, y) generating examples.",3.730769230769231,0.9807692307692307,3.6666666666666665,26,2005
"Dene R to be a constant such that x, ||(x)||  R. For all  The bound is minimized for the hyperplane with maximum margin (i.e., maximum value for ,b) on the training sample.",3.8636363636363638,0.8863636363636364,2.923076923076923,44,2005
"This bound suggests that if the training data is separable, the hyperplane with maximum margin should be chosen as the hypothesis with the best bound on its expected error.",2.903225806451613,0.967741935483871,3.806451612903226,31,2005
"It can be shown that the maximum margin hyperplane is unique, and can be found efciently using algorithms described in section 8.1.",2.4166666666666665,0.9791666666666666,2.7916666666666665,24,2005
"Search for the maximummargin hyperplane is the basis of Support Vector Machines (hard-margin version; Vapnik, 1998).",2.761904761904762,0.8095238095238095,2.28,21,2005
The previous theorem does not apply when the training data cannot be classied with 0 errors by a hyperplane.,2.380952380952381,0.7619047619047619,3.0,21,2005
"There is, however, a similar theorem that can be applied in the non-separable case.",2.411764705882353,0.9705882352941176,3.0,17,2005
"First, dene L(, b, ) to be the proportion of examples on training data with margin less than  for the hyperplane h,b.",2.107142857142857,1.0178571428571428,2.892857142857143,28,2005
The following theorem can now be stated.,2.125,0.8125,1.75,8,2005
"Theorem 6 Cristianini and Shawe-Taylor, 2000, Theorem 4.19.",3.1818181818181817,0.5454545454545454,4.0,11,2005
"Assume the hypothesis class H is a set of hyperplanes, and that there is some distribution D(x, y) generating examples.",3.730769230769231,0.9807692307692307,3.6666666666666665,26,2005
"Let R be a constant such that x, ||(x)||  R. For all h,b  H, for all  > 0, with probability at least 1   over the choice of training set of size m drawn from D.  (The rst result of the form of Theorem 6 was given in (Bartlett 1998).",4.546875,0.8203125,5.112903225806452,64,2005
This was a general result for large margin classiers; the immediate corollary that implies the above theorem was given in (Anthony and Bartlett 1999).,3.2142857142857144,0.7321428571428571,3.2142857142857144,28,2005
Note that Zhang (2002) proves a related theorem where the log2 m factor is replaced by log m. Note also that the square-root in the second term of theorem 6 means that this bound is in general a looser bound than the bound in theorem 5.,2.8979591836734695,1.0612244897959184,3.235294117647059,49,2005
"This is one cost of moving to the case where some training samples are misclassied, or where some training samples are classied with a small margin.)",3.793103448275862,0.9310344827586207,3.7586206896551726,29,2005
"This result is important in cases where a large proportion of training samples can be classied with relatively large margin, but a relatively small number of outliers make the problem inseparable, or force a small margin.",4.410256410256411,0.7948717948717948,3.9743589743589745,39,2005
"The result suggests that in some cases a few examples are worth giving up on, resulting in the rst term in the bound being larger than 0, but the second term being much smaller due to a larger value for .",4.6976744186046515,0.813953488372093,3.311111111111111,43,2005
"The soft margin version of Support Vector Machines (Cortes and Vapnik, 1995), described in section 8.1, attempts to explicitly manage the trade-off between the two terms in the bound.",4.628571428571429,0.7428571428571429,3.6486486486486487,35,2005
"Theorem 7 (Schapire et al., 1998).",2.9,0.6,2.8181818181818183,10,2005
"Assume the hypothesis class H is a set of hyperplanes in n, and that there is some distribution D(x, y) generating examples.",3.8214285714285716,1.0178571428571428,3.8461538461538463,28,2005
"This bound suggests a strategy that keeps the 1-norm of the parameters low, while trying to classify as many of the training examples as possible with large margin.",3.1333333333333333,1.1833333333333333,3.3333333333333335,30,2005
"It can be shown that the AdaBoost algorithm (Freund and Schapire, 1997) is an effective way of achieving this goal; its application to parsing is described in section 8.2.",4.117647058823529,0.8235294117647058,3.4411764705882355,34,2005
We now consider how the theory for hyperplane classiers might apply to the linear models for parsing described in section 2.,2.3636363636363638,1.0227272727272727,2.9545454545454546,22,2005
"The method for converting parsing to a margin-based problem is similar to the method for ranking problems described in (Freund et al., 1998), and to the approach to multi-class classication problems in (Schapire et al., 1998; Crammer and Singer, 2001; Elisseeff et al., 1999).",4.946428571428571,0.8035714285714286,6.761904761904762,56,2005
"As a rst step, we give a denition of the margins on training examples.",2.75,0.78125,2.1875,16,2005
"Assume we have a training sample {(x1, y1), .",2.9285714285714284,0.8571428571428571,3.357142857142857,14,2005
.,0.0,1.0,0.0,1,2005
.,0.0,1.0,0.0,1,2005
", (xm, ym)}.",2.75,1.0625,1.2,8,2005
"Theorem 8 Assume the hypothesis class H is a set of linear models as dened in equation (1.11) and equation (1.12), and that there is some distribution D(x, y) generating examples.",3.8048780487804876,0.926829268292683,3.923076923076923,41,2005
"For all h  H, for all  > 0, with probability at least 1   over the choice of training set of size m drawn from D,  where R is a constant such that x  X , y  GEN(x), z  GEN(x), ||(x, y)  (x, z)||  R. The variable N is the smallest positive integer such that x  X , |GEN(x)|  1  N.  Proof.",7.363636363636363,0.8939393939393939,4.069767441860465,66,2005
"The proof follows from results in (Zhang, 2002).",2.5,0.7916666666666666,2.0833333333333335,12,2005
See the appendix of this chapter for the proof.,1.9,0.95,2.5,10,2005
Note that this is similar to the bound in theorem 6.,2.0,1.0833333333333333,2.4166666666666665,12,2005
"A difference, however, is the dependence on N, a bound on the number of candidates for any example.",2.8181818181818183,0.8863636363636364,2.3636363636363638,22,2005
"Even though this term is logarithmic, the dependence is problematic because the number of candidate parses for a sentence will usually have an exponential dependence on the length of the sentence, leading to log N having linear  dependence on the maximum sentence length.",3.0869565217391304,0.9239130434782609,3.4680851063829787,46,2005
