sentence,yngve_score,frazier_score,dependency_distance_score,count,year
"Second, we assume some loss function, which dictates the penalty on test examples for proposing a parse which is incorrect.",2.5652173913043477,1.1304347826086956,2.5652173913043477,23,2005
"We focused on a simple loss function, where the loss is 0 if the proposed parse is identical to the correct parse, 1 otherwise.",2.925925925925926,0.8703703703703703,5.0,27,2005
"Under these assumptions, the quality of a parser is its expected loss (expected error rate) on newly drawn test examples.",3.125,0.6875,3.1923076923076925,24,2005
The goal of   learning is to use the training data as evidence for choosing a function which has small expected loss.,2.5454545454545454,1.0909090909090908,2.347826086956522,22,2005
A central idea in the analysis of learning algorithms is that of the margins on examples in training data.,2.5,1.1,2.0,20,2005
We described theoretical bounds which motivate approaches which attempt classify a large proportion of examples in training with a large margin.,2.409090909090909,1.2045454545454546,2.5,22,2005
"Finally, we described several algorithms which can be used to achieve this goal on the parsing problem.",2.210526315789474,1.0263157894736843,2.5789473684210527,19,2005
There are several open problems highlighted in this paper.,2.0,0.85,2.0,10,2005
"The margin bounds for parsing (theorems 8 and 9) both depend on N, a bound on the number of candidates for any input sentence.",3.3214285714285716,0.8392857142857143,2.2142857142857144,28,2005
It is an open question whether bounds which are independent of N can be proved.,2.375,1.21875,3.75,16,2005
"The perceptron algorithm in section 8.3 has generalization bounds which are independent of N, suggesting that this might also be possible for the margin bounds.",2.925925925925926,1.0185185185185186,2.962962962962963,27,2005
The Boosting and Support Vector Machine methods both require enumerating all members of GEN(xi) for each training example xi.,2.9565217391304346,0.9130434782608695,3.142857142857143,23,2005
"The perceptron algorithm avoided this in the case where the highest scoring hypothesis could be calculated efciently, for example using the CKY algorithm.",2.52,0.88,3.76,25,2005
It would be very useful to derive SVM and boosting algorithms whose computational complexity can be shown to depend on the separation  rather than the size of GEN(xi) for each training example xi.,3.2972972972972974,0.9864864864864865,2.4444444444444446,37,2005
"The boosting algorithm in section 8.2 optimized the quantity RL1, rather than the desired quantity L1.",2.9444444444444446,0.5277777777777778,2.8333333333333335,18,2005
It would be useful to derive a boosting algorithm which provably optimized L1.,2.0,1.25,2.357142857142857,14,2005
"I would like to thank Sanjoy Dasgupta, Yoav Freund, John Langford, David McAllester, Rob Schapire and Yoram Singer for answering many of the questions I have had about the learning theory and algorithms in this paper.",5.658536585365853,0.7560975609756098,2.951219512195122,41,2005
Fernando Pereira pointed out several issues concerning analysis of the perceptron algorithm.,2.076923076923077,0.8846153846153846,2.6923076923076925,13,2005
"Thanks also to Nigel Duffy, for many useful discussions while we were collaborating on the use of kernels for parsing problems.",3.652173913043478,0.8913043478260869,3.260869565217391,23,2005
I would like to thank Tong Zhang for several useful insights concerning margin-based generalization bounds for multi-class problems.,2.210526315789474,0.9473684210526315,2.5652173913043477,19,2005
"Thanks to Brian Roark for helpful comments on an initial draft of this paper, and to Patrick Haffner for many useful suggestions.",3.7916666666666665,0.7916666666666666,4.416666666666667,24,2005
"Thanks also to Peter Bartlett, for feedback on the paper, and some useful pointers to references.",2.8421052631578947,0.8421052631578947,3.5789473684210527,19,2005
"The proofs in this section closely follow the framework and results of (Zhang, 2002).",3.111111111111111,0.6944444444444444,2.2222222222222223,18,2005
"The basic idea is to show that the covering number results of (Zhang, 2002) apply to the parsing problem, with the modication that any dependence on m (the sample size) is replaced by a dependence on mN (where N is the smallest integer such that .",2.8867924528301887,0.8584905660377359,3.849056603773585,53,2005
"In the problems in this paper we again assume that sample points are (x, y) pairs, where x  X is an input, and y  Y is the correct structure for that input.",5.026315789473684,0.7894736842105263,3.125,38,2005
There is some function GEN(x) which maps any x  X to a set of candidates.,2.5789473684210527,0.9473684210526315,2.5555555555555554,19,2005
There is also a function  .,1.6666666666666667,0.9166666666666666,2.0,6,2005
"X  Y  n that maps each (x, y) pair to a feature vector.",3.0,0.8529411764705882,3.0526315789473686,17,2005
"We will transform any sample point (x, y) to a matrix Z  N n in the following way.",3.5,0.6590909090909091,2.391304347826087,22,2005
Take N to be a positive integer such that |GEN(x)| = (N + 1).,2.590909090909091,0.8181818181818182,3.5294117647058822,22,2005
"Zhang (2002) shows how bounds on the covering numbers of L lead to the theorems 6 and 8 of (Zhang, 2002), which are similar but tighter bounds than the bounds given in theorems 6 and 7 in section 6 of the current paper.",3.68,0.96,3.4,50,2005
"Theorem A1 below states a relationship between the covering numbers for L and M. Under this result, theorems 8 and 9 in the current paper follow from the covering bounds on M in exactly the same way that theorems 6 and 8 of (Zhang, 2002) are  derived from the covering numbers of L, and theorem 2 of (Zhang, 2002).",4.264705882352941,0.8676470588235294,2.36231884057971,68,2005
So theorem A1 leads almost directly to theorems 8 and 9 in the current paper.,2.4375,0.65625,2.4375,16,2005
