sentence,yngve_score,frazier_score,dependency_distance_score
"4.2 Early Update During Training As before, dene yi to be the gold standard parse for the ith sentence, and also dene yj i to be the partial analysis under the gold-standard parse for the rst j words of i / Fj(xi) a search error has the ith sentence.",4,0.9090909090909091,3
"Then if yj been made, and there is no possibility of the gold standard parse yi being in the nal set of parses, Fn(xi).",2,0,3
"We call the following modication to the parsing algorithm i / Fj(xi), exit the during training early update.",3,1.0434782608695652,5
"if yj i , Fj(xi) to the parameter estimaparsing process, pass yj tion method, and move on to the next string in the training set.",3,0.7258064516129032,2
"Intuitively, the motivation behind this is clear.",2,0.9444444444444444,2
"It makes sense to make a correction to the parameter values at the point that a search error has been made, rather than allowing the parser to continue to the end of the sentence.",3,0.9583333333333334,3
"This is likely to lead to less noisy input to the parameter estimation algorithm; and early update will also improve efciency, as at the early stages of training the parser will frequently give up after a small proportion of each sentence is processed.",3,0.9021739130434783,3
"It is more difcult to justify from a formal point of view, we leave this to future work.",3,0.825,2
Figure 5 shows the convergence of the training algorithm with neither of the two renements presented; with just early update; and with both.,4,0.8461538461538461,3
Early update makes  Figure 5.,1,0,1
"Performance on development data (section f24) after each pass over the training data, with and without repeated use of examples and early update.",4,0.8333333333333334,3
"an enormous difference in the quality of the resulting model; repeated use of examples gives a small improvement, mainly in recall.",3,0.7708333333333334,2
The parsing models were trained and tested on treebanks from the Penn Wall St. Journal Treebank.,2,0.5588235294117647,2
sections 2-21 were kept training data; section 24 was held-out development data; and section 23 was for evaluation.,4,0,3
"After each pass over the training data, the averaged perceptron model was scored on the development data, and the best performing model was used for test evaluation.",4,0.7333333333333333,2
"For this paper, we used POS tags that were provided either by the Treebank itself (gold standard tags) or by the perceptron POS tagger3 presented in Collins (2002).",3,0.8970588235294118,3
The former gives us an upper bound on the improvement that we might expect if we integrated the POS tagging with the parsing.,2,1.0208333333333333,2
"3For trials when the generative or perceptron parser was given POS tagger output, the models were trained on POS tagged sections 2-21, which in both cases helped performance slightly.",4,0.953125,3
Table 3.,1,1,1
"Parsing results, section 23, all sentences, including labeled precision (LP), labeled recall (LR), and F-measure  Table 3 shows results on section 23, when either goldstandard or POS-tagger tags are provided to the parser4.",3,0.8068181818181818,4
"With the base features, the generative model outperforms the perceptron parser by between a half and one point, but with the additional punctuation features, the perceptron model matches the generative model performance.",4,0,3
"Of course, using the generative model and using the perceptron algorithm are not necessarily mutually exclusive.",3,0.6388888888888888,3
"Another training scenario would be to include the generative model score as another feature, with some weight in the linear model learned by the perceptron algorithm.",2,0.7142857142857143,2
This sort of scenario was used in Roark et al.,2,0.9545454545454546,1
(2004) for training an n-gram language model using the perceptron algorithm.,2,0.9285714285714286,3
"We follow that paper in xing the weight of the generative model, rather than learning the weight along the the weights of the other perceptron features.",3,0.875,2
The value of the weight was empirically optimized on the held-out set by performing trials with several values.,2,1.0,2
Our optimal value was 10.,2,0.75,1
"In order to train this model, we had to provide generative model scores for strings in the training set.",3,0.8809523809523809,2
"Of course, to be similar to the testing conditions, we cannot use the standard generative model trained on every sentence, since then the generative score would be from a model that had already seen that string in the training data.",3,0.8111111111111111,3
"To control for this, we built ten generative models, each trained on 90 percent of the training data, and used each of the ten to score the remaining 10 percent that was not seen in that training set.",3,0.8571428571428571,3
"For the held-out and testing conditions, we used the generative model trained on all of sections 2-21.",3,0.8157894736842105,3
"In table 4 we present the results of including the generative model score along with the other perceptron features, just for the run with POS-tagger tags.",3,0.75,3
The generative model score (negative log probability) effectively provides a much better initial starting point for the perceptron algorithm.,3,0.5681818181818182,3
The resulting F-measure on section 23 is 2.1 percent higher than either the generative model or perceptron-trained model used in isolation.,3,0.75,2
"6 Conclusions In this paper we have presented a discriminative training approach, based on the perceptron algorithm with a couple of effective renements, that provides a model capable of effective heuristic search over a very difcult search space.",3,0.7682926829268293,3
"In such an approach, the unnormalized discriminative parsing model can be applied without either  4When POS tagging is integrated directly into the generative parsing process, the baseline performance is 87.0.",5,0.7424242424242424,3
"For comparison with the perceptron model, results are shown with pre-tagged input.",3,0.8214285714285714,2
Table 4.,1,1,1
"Parsing results, section 23, all sentences, including labeled precision (LP), labeled recall (LR), and F-measure  an external model to present it with candidates, or potentially expensive dynamic programming.",5,0.7948717948717948,5
"When the training algorithm is provided the generative model scores as an additional feature, the resulting parser is quite competitive on this task.",4,0.64,2
The improvement that was derived from the additional punctuation features demonstrates the exibility of the approach in incorporating novel features in the model.,2,0.9791666666666666,2
Future research will look in two directions.,1,0.8125,1
"First, we will look to include more useful features that are difcult for a generative model to include.",2,1.15,2
This paper was intended to compare search with the generative model and the perceptron model with roughly similar feature sets.,2,0.7619047619047619,2
Much improvement could potentially be had by looking for other features that could improve the models.,2,1.1470588235294117,2
"Secondly, combining with the generative model can be done in several ways.",2,0.75,3
Some of the constraints on the search technique that were required in the absence of the generative model can be relaxed if the generative model score is included as another feature.,2,0.953125,2
"In the current paper, the generative score was simply added as another feature.",2,0.6333333333333333,2
"Another approach might be to use the generative model to produce candidates at a word, then assign perceptron features for those candidates.",3,0.875,3
Such variants deserve investigation.,1,0.9,1
"Overall, these results show much promise in the use of discriminative learning techniques such as the perceptron algorithm to help perform heuristic search in difcult domains such as statistical parsing.",2,0.75,3
